1705,"U/S SARDULGARH, PUNJAB",PUNJAB,4.8,7.4,17.0,4.7,20500.0,666.6862684057971
1448,"NAGAVALLI AT THOTAPALLI REGULATOR, AP",ANDHRA PRADESH,7.8,7.540000000000001,1.7,2.19,2.19,59.78431604347829
1428,"KYRHUKHLA NEAR SUTNGA KHLIERIAT,JAINTIA HILLS DT.,MEGHALAYA",MEGHALAYA,5.0,3.2,7.0,2.5,27.0,43.19624115942029
3471,"RIVER KARAMANA AT ARUVIKARA, THIRUVANANTHAPURAM",KERALA,7.0,7.4,0.9,0.32,800.0,69.50849536231887
2423,"BUDHABALANGA, D/S OF BARIPADA TOWN",ORISSA,7.5,7.8,1.4,0.89,8281.0,247.75948057971016
1152,KUNDALIKA AT ROHA CITY,MAHARASHTRA,6.9,7.5,3.6,0.4,316.0,84.76518898550724
1543,RIVER KALNA AT CHANDELNAN PERNEM,GOA,7.3,6.1,0.9,0.33,6.0,27.68714782608695
2301,R KAVVAI AT KUTTIYOL PALAM,KERALA,6.3,6.8,1.2,0.16,73.0,48.77411072463769
1442,VAMANAPURAM,KERALA,7.5,6.8,1.3,0.6,178.0,46.32329391304348
1155,KARAMANA AT MOONNATTUMUKKU,KERALA,1.8,6.8,5.5,1.8,20458.0,566.4111104347826
1330,"TAMBIRAPARANI AT ARUMUGANERI, TAMILNADU",TAMIL NADU,7.5,7.2,2.1,0.1,220.0,61.26972724637681
1148,"AMBIKA AT BILIMORA, GUJARAT",GUJARAT,6.8,8.0,2.8,0.3,32120.0,801.1034226086957
1633,SIMSANG RIVER WILLIAMNAGAR,MEGHALAYA,7.8,7.1,1.9,0.52,303.0,58.1417663768116
2289,R KARUVANNURR AT KARUVANNUR BRIDGE,KERALA,6.0,6.4,1.4,0.61,193.0,47.7614715942029
2422,"NAGAVALI PENTA U/S, JAYKAYPUR TOWN",ODISHA,7.3,8.0,1.3,0.5,1295.0,93.18911449275365
2459,DAMANGANGA AT ZUARI CAUSE WAY BRIDGE,DAMAN,4.2,7.9,18.0,7.0,92.5,228.9823768115942
2272,"RIVER KUSHAWATI NEAR BUND AT KEVONA,RIVON,SANGUEM",GOA,6.6,7.2,1.9,0.34,105.0,61.32616985507247
1571,"KAKKADAVU,  KERALA",KERALA,7.5,7.3,0.8,0.31,1253.0,74.67312724637682
1154,CHALAKUDY AT PULICKALKANANDAVU,KERALA,6.5,6.9,1.3,0.47,468.0,59.40399014492755
2301,R KAVVAI AT KUTTIYOL PALAM,KERALA,6.0,6.4,2.1,0.28,87.0,51.5794115942029
3350,UMKHEN AT WAHKDAIT,MEGHALAYA,7.1,7.1,1.9,5.6,22.0,55.7592084057971
3471,"RIVER KARAMANA AT ARUVIKARA, THIRUVANANTHAPURAM",KERALA,7.4,7.0,0.1,0.0,165.0,39.26764086956521
3029,"TAMBIRAPARANI AT SIVALAPERI, CONFLUENCE POINT OF KUTTRALAM FALLS, D/S OF PALAYAMKOTTAI, TIRUNELVELI",TAMILNADU,6.7,7.6,4.1,0.15,92.0,86.85992956521739
2670,"KAN NEAR SAKRI WATER WORKS, SAKRI, DHULE",MAHARASHTRA,5.5,8.1,8.4,2.15,16.0,137.91541971014487
1718,"GAGGAR RIVER WHEN ENTERING IN RAJASTHAN FROM HARYANA NEAR RD NO. 629, RAJASTHAN",RAJASTHAN,4.4,8.23,1.39,0.08,14.0,83.16489623188407
2423,"BUDHABALANGA, D/S OF BARIPADA",ORISSA,7.8,7.9,1.5,0.35,7742.0,236.11749971014493
1295,"GHAGGAR NEAR BANKARPUR,DERA BASSI,PUNJAB",PUNJAB,5.3,7.2,11.3,4.0,1350.0,179.9901002898551
1567,"R KUTTIYADE AT KUTTIYADY ESTATE, KERALA",KERALA,7.2,7.2,0.7,0.2,441.0,55.19058144927536
1564,"AYUR, KERALA",KERALA,6.2,7.0,0.6,0.93,282.0,52.18574434782608
3375,LUKHA RIVER,MEGHALAYA,6.8,2.7,3.2,2.33,4.0,-8.214970724637684
2295,R CORAPUZHA AT KANAYANKODE,KERALA,5.6,7.0,1.2,0.41,725.0,73.15973275362319
2332,R BHARATHAPUZHA AT PATTAMBI,KERALA,7.1,7.6,0.5,0.19,710.0,67.03921507246376
2164,VASHISTI RIVER AT U/S OF THREE M PAPER MILLS NEAR M/S MULTIFILMS PLASTIC PVT. LTD. AT KHERDI.,MAHARASHTRA,6.9,7.5,2.8,1.0,3.0,70.73794898550724
1443,"ACHENKOIL AT CHENNITHULA, KERALA",KERALA,5.8,7.4,1.4,0.8,285.0,68.22737884057972
1476,"MANDOVI AT TONCA, MARCELA, GOA",GOA,6.5,7.1,1.6,0.1,1243.0,83.4849968115942
1547,"RIVER TALPONA AT CANACONA, GOA",GOA,6.9,6.7,0.9,0.21,691.0,55.35945565217392
1399,ZUARI AT D/S OF PT. WHERE KUMBARJRIA CANAL JOINS,GOA,6.6,6.5,1.8,0.87,0.0,45.86009652173913
2072,RIVER BHOGAVO D/S OF SURENDRANAGAR,GUJARAT,8.2,8.4,2.9,0.0,53.5,82.10907521739131
1342,"ACHENKOIL AT THUMPAMON, KERALA",KERALA,6.71,6.96,0.67,0.45,1457.0,75.95226886956522
1546,"RIVER KHANDEPAR AT OPA NAN PONDA, GOA",GOA,7.2,6.5,1.6,0.25,17.0,43.30958811594203
1092,"KALU AT ATALE VILLAGE, MAHARASHTRA",MAHARASHTRA,7.5,7.413000000000001,6.5,0.51,0.51,98.98239691304347
1328,"TAMBIRAPARANI AT PAPPANKULAM,TAMILNADU",TAMILNADU,7.1,6.3,3.5,1.0,24.0,55.584915072463765
2307,R MANJESWAR AT BAJRAKKARA BR.,KERALA,7.6,6.8,1.6,0.31,48.0,45.50334028985508
1462,"PATALGANGA NEAR INTAKE OF MIDC W/W, MAHARASHTRA",MAHARASHTRA,7.1,7.5,3.4,4.4,17.0,75.75688840579708
2706,"SURYA RIVER, U/S OF SURYA DAM, DHAMMI, VIKRAMGAD, THANE",MAHARASHTRA,7.0,8.3,3.8,0.48,44.0,93.8485286956522
1633,"SIMSANG RIVER WILLIAMNAGAR, MEGHALAYA",MEGHALAYA,9.0,7.3,1.8,7.2,220.0,53.828029565217385
1456,"RUSHIKULYA AT GANJAM D/S, ORISSA",ORISSA,7.5,7.35,2.25,0.74,1515.0,100.93474057971014
1093,"ULHAS AT U/S OF NRC BUND AT MOHANE, MAHARASHTRA",MAHARASHTRA,6.9,7.6,3.8,0.26,143.0,84.38392231884058
1450,"PALAR AT VANIYAMBADI WATER SUPPLY HEAD WORK, TAMILNADU",TAMIL NADU,7.5,7.491999999999999,2.6,0.16,0.16,65.80520924637679
2352,"RIVER VAMSHADHARA, KALINGAPATNAM,VIZIANAGARAM",ANDHRA PRADESH,5.4,7.8,0.8,2.4,7.0,65.73844
1339,"MEENACHIL AT KIDANGOOR, KERALA",KERALA,6.8,6.6,0.5,0.44,1225.0,62.583449275362334
1544,"RIVER VALVANT AT SANKLI NAN BICHOLIM, GOA",GOA,7.2,6.3,1.5,0.1,7942.0,215.264068115942
1434,"AMLAKHADI AFTER CONFL. OF W. WATER FROM ANKLESH,GUJARAT",GUJARAT,0.0,7.1,46.0,4.8,3000.0,548.649095652174
1861,RIVER PURNA ON BRIDGE AT SURATNANNAVSARI HIGHWAY,GUJARAT,7.1,8.0,2.0,0.35,7500.0,240.35588840579717
1160,"TAMBIRAPARANI AT CHERANMADEVI,CAUSE WAY,TAMILNADU",TAMIL NADU,5.8,6.6,1.0,0.26,25.0,44.86087884057972
2685,"PATALGANGA RIVER AT D/S OF KHARPADA BRIDGE, RAIGAD.",MAHARASHTRA,5.6,6.9,4.5,1.72,58.0,82.99877942028985
3372,"RILANG AT MAWKYRWAT, WEST KHASI HILLS",MEGHALAYA,8.0,7.1,1.4,3.35,10.0,46.48232579710144
1329,"TAMBIRAPARANI AT RAIL BDG. NR. AMBASAMUDAM, TAMILNADU",TAMILNADU,6.7,6.4,4.6,0.1,10.0,68.56190289855073
2275,"RIVER CHAPORA NEAR ALORNA FORT ,PERNEM",GOA,7.0,7.0,1.2,0.66,1298.0,76.57392869565217
1438,MINDHOLA AT STATE HIGHWAY BRIDGE SACHIN,GUJARAT,4.6,7.2,4.0,0.33,900.0,107.58115565217392
21,CHALIYAR AT CHUNGAPALLY,KERALA,7.0,7.3,0.9,0.29,256.0,57.96639536231885
3464,"CHALIYAR AT NILAMBUR, MALAPPURAM",KERALA,6.8,7.1,0.8,0.5,693.0,61.98602927536233
1699,GHAGGAR AT U/S DHAKANSU NALLAH,PUNJAB,4.9,7.4,17.5,4.77,22000.0,704.4017547826087
2050,TLAWNG UPSTREAM AIZAWL,MIZORAM,6.5,7.4,1.0,0.13,26.0,55.51455681159421
2302,R NEELASWARAM AT NAMBIARKAL DAM,KERALA,6.5,6.5,0.7,0.25,850.0,55.9534768115942
1444,"KALI AT D/S WEST COAST PAPER MILL, KARNATAKA",KARNATAKA,6.9,7.3,4.33,1.0,322.0,88.05058898550725
1428,"KYRHUKHLA NEAR SUTNGA KHLIERIAT,JAINTIA HILLS DT.,MEGHALAYA",MEGHALAYA,5.2,2.9,7.8,1.5,16.0,43.76601391304346
2198,KUNDALIKA RIVER AT ARE KHURD ( SALINE ZONE ),MAHARASHTRA,6.4,7.4,37.8,1.79,413.0,390.6185171014493
1894,KUMARADHARA NAN U/S OF UPPINAGADY TOWN BEFORE CONFLUENCE WITH RIVER NETHRAVATHI,KARNATAKA,6.6,7.1,1.5,0.67,74.0,55.38428985507246
3380,"DAMRING RIVER (KRISHNEI RIVER) AT RESUBELPARA, EAST GARO HILLS",MEGHALAYA,9.9,7.2,1.5,2.31,21.0,40.10414695652174
1568,"R MAHE AT VALAYAM, KERALA",KERALA,7.3,7.2,0.6,0.19,160.0,47.57460115942029
2051,"TLAWNG DOWNSTREAM AIZAWL, MIZORAM",MIZORAM,6.5,7.9,0.6,0.1166666666666666,3.0,60.02585903381644
1861,RIVER PURNA ON BRIDGE AT SURATNANNAVSARI HIGHWAY,GUJARAT,6.0,8.2,2.28,0.4,28650.0,730.834411594203
2304,R MOGRAL AT MOGRAL BR.,KERALA,5.6,7.2,2.1,0.3,92.0,72.8825660869565
1698,GHAGGAR AT D/S CHHATBIR,PUNJAB,5.7,7.5,24.0,14.18,7863.0,443.34420579710144
3359,"UMKHRAH RIVER AT DEMTHRING, SHILLONG",MEGHALAYA,3.1,7.2,21.8,19.0,22556.0,759.3414333333334
21,"CHALIYAR AT CHUNGAPALLY, KERALA",KERALA,6.8,7.04,0.41,0.15,238.0,49.096540608695655
2704,"SAVITRI RIVER AT MUTHAVALI VILLAGE, MAHAD, RAIGADH",MAHARASHTRA,6.3,7.7,4.4,5.37,4.0,94.38019739130436
2293,R KADALUNDI AT HAJIRAPPALLY,KERALA,6.9,7.0,0.9,0.08,300.0,51.84438231884057
2336,R PERIYAR AT PURAPPALLIKAVU,KERALA,6.6,7.1,1.3,0.2,356.0,60.234263188405805
1572,CHANDRAGIRI AT PADIYATHADKA,KERALA,7.5,7.2,0.6,0.15,285.0,49.46471391304348
1564,"R ITHIKKARA AT AYUR, KERALA",KERALA,6.7,7.5,1.6,0.9,199.0,65.4692295652174
1450,"PALAR AT VANIYAMBADI WATER SUPPLY HEAD WORK, TAMILNADU",TAMIL NADU,6.3,7.6,1.8,0.24,738.0,83.24285739130437
2319,ANCHARAKANDY AT MERUVAMBA,KERALA,7.0,6.7,1.1,0.37,158.0,45.91524202898552
1473,"GHAGGAR AT RATANHERI, D/S OF PATIALA NADI (AFTER CONFL.), PUNJAB",PUNJAB,5.7,7.3,14.3,13.75,20250.0,635.4293324637681
1384,"MANIMALA AT THONDRA, KERALA",KERALA,7.0,6.741111111111111,0.5,0.3,0.3,37.17320158454106
1870,"RIVER SUKHANA AT PARWANOO, DISTT. SOLAN, H.P.",HIMACHAL PRADESH,4.4,7.1,41.0,1.2,92.0,416.1052295652174
2291,R KEECHERI AT VADAKKANCHERY BRIDGE,KERALA,5.6,7.3,1.6,0.4,268.0,68.81045942028986
2293,R KADALUNDI AT HAJIRAPPALLY,KERALA,6.6,6.8,1.0,0.2,275.0,50.1212031884058
1631,"MYNTDU RIVER JOWAI, MEGHALAYA",MEGHALAYA,8.8,7.0,1.6,5.0,1800.0,83.04675014492753
1150,DAMANGANGA AT KACHIGAON U\S AT GIDC WIER,GUJARAT,7.1,7.3,1.4,0.84,3.0,53.88842173913043
2337,R KADAMBAYAR AT BRAHMAPURAM,KERALA,2.9,6.7,2.2,1.28,403.0,80.02398057971016
1633,"SIMSANG RIVER WILLIAMNAGAR, MEGHALAYA",MEGHALAYA,7.0,7.0,1.7,2.43,250.0,57.51960869565219
2306,R UPPALA AT  UPPALA BR.,KERALA,6.2,7.2,1.3,0.22,61.0,58.84579768115942
1473,"GHAGGAR AT RATANHERI, D/S OF PATIALA NADI (AFTER CONFL.), PUNJAB",PUNJAB,4.83,7.53,13.33,1.93,2300.0,232.00836898550727
1154,"CHALAKUDY AT PULICKALKANANDAVU, KERALA",KERALA,6.5,6.6,1.2,0.37,142.0,45.9984568115942
2292,THIRUR AT THALAKKADATHUR BDG,KERALA,4.5,6.6,2.1,0.34,196.0,66.10327594202899
2688,"PATALGANGA RIVER AT SAVROLI BRIDGE, KHALAPUR, RAIGAD.",MAHARASHTRA,7.2,7.6,3.4,1.89,29.0,77.00257478260869
2050,TLAWNG UPSTREAM AIZAWL,MIZORAM,6.6,7.3,1.3,0.12,8.5,55.502966521739125
1569,"THALIPARAMBA, KERALA",KERALA,6.6,6.9,0.7,0.3,338.0,53.22569652173913
2712,"VAITARNA NEAR ROAD BRIDGE, GANDHARE VILLAGE, WADA, THANE",MAHARASHTRA,6.8,8.2,4.0,0.49,49.0,94.991895942029
2423,"BUDHABALANGA, D/S OF BARIPADA TOWN",ORISSA,7.5,8.0,1.9,0.39,3005.0,136.3442939130435
1544,"RIVER VALVANT AT SANKLI NAN BICHOLIM, GOA",GOA,7.4,7.0,2.45,0.13,467.0,66.85329420289855
1162,"TAMBIRAPARANI AT MURAPPANADU, TAMILNADU",TAMIL NADU,7.5,7.121111111111111,1.2,0.57,0.57,46.96626380193237
1155,KARAMANA AT MOONNATTUMUKKU,KERALA,0.5,7.1,21.2,4.41,3317.0,334.8805208695652
3359,"UMKHRAH RIVER AT DEMTHRING, SHILLONG",MEGHALAYA,3.9,7.1,16.9,16.61,16500.0,574.3888310144927
1341,"PAMBA AT THAKAZHY, KERALA",KERALA,6.1,6.7,0.9,0.33,655.0,58.46131130434783
1476,"MANDOVI AT TONCA, MARCELA, GOA",GOA,6.1,6.7,1.4,0.3,3355.0,123.57109130434782
1462,"PATALGANGA NEAR INTAKE OF MIDC W/W, MAHARASHTRA",MAHARASHTRA,6.9,7.5,3.4,0.54,149.0,79.2714356521739
1024,"GHAGGAR AT 100M D/S CONF. WITH R. SARASWATI (PATIALA),PUNJAB",PUNJAB,5.3,7.4,27.0,3.35,48000.0,1399.9462536231886
1149,KOLAK AT PATALIA BDG.,GUJARAT,3.7,8.2,4.3,1.66,6.0,111.78457159420287
1149,"KOLAK AT PATALIA BDG., GUJARAT",GUJARAT,6.08,7.7,3.2,0.15,450.0,91.97466869565216
1568,"VALAYAM, KERALA",KERALA,6.63,7.07,0.63,0.45,337.0,52.859630434782616
1023,"GHAGGAR AT MUBARAKPUR REST HOUSE (PATIALA), PUNJAB",PUNJAB,6.03,7.37,3.27,0.67,2390.0,131.07251150724636
1563,R NEYYAR AT AMARAVILA,KERALA,6.6,7.3,1.4,0.39,838.0,75.07809652173913
1572,PADIYATHADKA,KERALA,7.6,7.3,1.0,0.63,1175.0,74.26570695652174
2696,"PEHLAR DAM ON PEHLAR RIVER INLET OF WATER WORKS, VASAI, THANE.",MAHARASHTRA,6.3,7.8,4.6,0.9,15.0,95.02341739130436
2460,DAMANGANGA AT DISCHARG POINT DISTILLARY,DAMAN,3.7,7.5,13.5,25.71,96.5,194.33658826086955
2162,ULHAS ATJAMBHUL WATER WORKS,MAHARASHTRA,6.7,7.6,2.9,0.76,24.0,74.75038289855074
1870,"RIVER SUKHANA AT PARWANOO, DISTT. SOLAN, H.P.",HIMACHAL PRADESH,5.48,7.82,6.9,1.26,87.25,121.4686254347826
2300,R PERUVAMBA AT CHANDAPPURA,KERALA,7.3,6.2,0.9,0.21,195.0,33.61662782608696
2947,"RIVER JAWAI AT JAWAI DAM, SIROHI, RAJASTHAN",RAJASTHAN,5.9,8.0,0.9,0.7,4.0,67.43781855072463
3460,"KALPATHI PUZHA AT KALPATHI, PALAKKAD",KERALA,6.1,7.6,1.2,0.7,384.0,70.71350463768115
1567,"KUTTIYADY ESTATE, KERALA",KERALA,6.9,6.65,0.5,0.1,130.0,38.33240898550725
1094,"ULHAS AT U/S OF BADLAPUR, MAHARASHTRA",MAHARASHTRA,6.3,7.6,4.6,0.6,13.0,91.46605739130436
1642,"NAGAVALLI AT JAYKAYPUR D/S, ORISSA",ORISSA,7.5,8.2,2.5,0.89,2600.0,135.67374057971014
1719,"GAGGAR D/S HANUMANGARH NEAR 2 KNJ NAI ABADI, MAKKASR, ",PUNJAB,4.9,8.0,1.2,0.35,4.0,74.88846144927537
2653,"BHATSA RIVER AT D/S OF LIBERTY OIL MILLS, SATNEL, SHAHAPUR, THANE",MAHARASHTRA,6.9,7.7,3.7,0.57,48.0,83.11653565217392
1450,PALAR AT VANIYAMBADI WATER SUPPLY HEAD WORK,TAMIL NADU,6.4,7.6,3.3,0.4,253.0,84.98434376811595
2949,"RIVER LUNI AT RANAKPUR DAM, RANAKPUR, PALI",RAJASTHAN,5.9,7.9,1.5,0.48,4.0,71.0756452173913
2053,TUIRIAL LOWER CATCHMENT,MIZORAM,7.9,7.5,1.8,0.145,41.0,57.86517942028985
2427,VANSADHARA ATGUNUPUR (INTERSTATE BOUNDRY),ORISSA,7.2,8.1,1.6,0.36,1239.0,96.83639478260868
2275,"RIVER CHAPORA NEAR ALORNA FORT ,PERNEM",GOA,7.0,6.3,1.6,0.42,8.0,38.99034869565218
1443,ACHENKOIL AT CHENNITHULA,KERALA,5.4,6.7,0.9,0.42,463.0,57.49722
3375,LUKHA RIVER AT MYNDIHATI (TRIBUTARY OF LUNAR),MEGHALAYA,6.7,2.7,3.3,1.1,7.0,-6.855043768115951
2338,R KADAMBAYAR AT MANCKAKADAVU,KERALA,3.0,6.1,2.0,0.13,268.0,64.11350028985508
2672,"KUNDALIKA RIVER AT DHATAV AT JACKWELL, DHATAV, ROHA, RAIGAD",MAHARASHTRA,7.2,7.9,3.2,0.42,164.0,83.30013478260868
2686,"PATALGANGA RIVER AT VYAL PUMP HOUSE , KHALAPUR, RAIGAD.",MAHARASHTRA,6.5,7.3,3.0,0.59,132.0,73.80395014492754
20,CHALIYAR AT KOOLIMADU,KERALA,7.3,7.2,0.6,0.31,468.0,54.49242115942029
2272,"KUSHAWATI NEAR BUND AT KEVONA,RIVON,SANGUEM",GOA,6.8,6.0,1.9,0.75,9.0,37.314862608695655
1149,KOLAK AT PATALIA BDG,GUJARAT,2.4,7.6,6.2,1.31,3.0,124.53339536231884
2670,"KAN RIVER, NEAR SAKRI WATER WORKS, SAKRI, DHULE.",MAHARASHTRA,5.6,7.9,3.6,1.9,66.0,92.59439942028988
2274,RIVER MAPUSA ON CULVERT ON HIGHWAY MAPUSANANPANAJI,GOA,3.6,7.0,2.0,0.09,33.0,71.4064852173913
2337,R KADAMBAYAR AT BRAHMAPURAM,KERALA,2.1,6.8,1.6,0.8,431.0,80.61453623188406
2651,"AMBA AT D/S OF WAKEN BDG U/S OF JS PETROCHEMICALS, WAKENPHATA, ROHA",MAHARASHTRA,6.8,7.9,3.5,0.58,286.0,90.654715942029
1543,"RIVER KALNA AT CHANDELNAN PERNEM, GOA",GOA,8.1,7.7,2.6,0.1,79.0,69.85128550724637
2303,R PULLUR AT PULLUR BR.,KERALA,6.7,6.3,0.9,0.1,136.0,36.983282898550726
1161,"TAMBIRAPARANI AT TIRUNELVELI,COLLECTORATE,TAMILNADU.",TAMILNADU,6.6,6.5,2.5,0.2,13.0,52.2859431884058
1861,RIVER PURNA ON BRIDGE AT SURATNANNAVSARI HIGHWAY,GUJARAT,8.1,8.038571428571428,2.0,0.5066666666666667,10441.57142857143,299.2441963008972
2319,R ANCHARAKANDY AT MERUVAMBA,KERALA,7.0,6.6,1.5,0.37,208.0,48.40924202898551
1642,NAGAVALLI AT JAYKAYPUR D/S,ORISSA,6.8,8.1,2.6,1.16,2428.0,134.6109292753623
1403,"GUMTI AT U/S SOUTH TRIPURA,TRIPURA",TRIPURA,6.2,7.8,2.1,0.0,282.0,79.23180434782607
2688,"PATALGANGA RIVER AT SAVROLI BRIDGE, KHALAPUR. RAIGAD",MAHARASHTRA,6.6,7.4,5.0,0.74,67.0,91.3159231884058
3383,"BUGI RIVER AT MIBANPARA, SOUTH GARO HILLS",MEGHALAYA,7.7,7.2,1.8,2.67,22.0,53.41062
2306,R UPPALA AT  UPPALA BR.,KERALA,6.9,7.2,1.3,0.2,113.0,59.29292231884058
1543,"RIVER KALNA AT CHANDELNAN PERNEM, GOA",GOA,8.3,6.68,2.5,1.69,13.0,47.466209594202894
3377,"MYNTANG RIVER AT NARTIANG, JAYANTIA HILLS",MEGHALAYA,7.3,7.1,1.9,2.5,24.0,54.50164115942029
1643,"NAGAVALLI AT RAYAGADA D/S, ORISSA",ORISSA,7.2,7.983000000000001,2.1,1.03,1.03,72.48047511594204
1340,"MANIMALA  AT KALLOOPARA, KERALA",KERALA,6.8,7.1,1.5,0.5,130.0,55.58656927536232
2689,"PATALGANGA RIVER AT GAGANGIRI MAHARAJ TEMPLE, KHOPOLI, KHALAPUR, RAIGAD",MAHARASHTRA,6.6,7.4,3.7,0.53,147.0,81.5586431884058
1862,RIVER KAVERI ON BRIDGE AT BILLIMORANANVALSAD ROAD,GUJARAT,6.2,7.98,5.0,0.39,7147.0,273.1999443478261
3373,"WAH BLEI AT RIANGDO, WEST KHASI HILLS",MEGHALAYA,7.5,7.3,1.9,3.3,21.0,57.03219391304348
1339,"MEENACHIL AT KIDANGOOR, KERALA",KERALA,6.67,6.93,0.93,0.89,2333.0,97.60892231884056
1456,"RUSHIKULYA AT GANJAM D/S, ",ORISSA,6.8,7.8,1.9,0.67,145.0,76.83795594202898
43,MUVATTAPUZHA AT VETTIKKATTUMUKKU,KERALA,6.7,6.9,1.2,0.46,385.0,55.94716289855074
1703,"GHAGGER AT MOONAK, PUNJAB",PUNJAB,5.1,7.48,14.7,2.3,4325.0,285.27365753623195
1148,"AMBIKA AT BILIMORA, GUJARAT",GUJARAT,8.0,8.01625,3.5,0.8071428571428572,8071.875,259.3054602494824
1548,RIVER ASSONORA AT ASSONORA,GOA,7.3,5.9,1.5,0.22,8.0,29.554341159420296
1718,"GAGGAR RIVER WHEN ENTERING IN RAJASTHAN FROM HARYANA NEAR RD NO. 629, RAJASTHAN",RAJASTHAN,4.8,7.6,0.8,0.0,4.0,64.79940173913045
2274,RIVER MAPUSA ON CULVERT ON HIGHWAY MAPUSANANPANAJI,GOA,7.3,6.8,2.5,0.42,87.0,60.32240782608696
2162,ULHAS RIVER ATJAMBHUL WATER WORKS.,MAHARASHTRA,5.9,7.2,4.04,0.65,133.0,84.17425188405797
1476,"MANDOVI AT TONCA, MARCELA, GOA",GOA,7.8,6.69,2.75,0.35,13.0,52.08797771014494
2168,MITHI RIVER,MAHARASHTRA,4.9,7.6,55.5,2.18,560.0,565.8697414492754
2688,"PATALGANGA RIVER AT SAVROLI BRIDGE, KHALAPUR, RAIGAD.",MAHARASHTRA,6.4,7.3,3.1,0.6,68.0,73.73713043478259
1564,"AYUR, KERALA",KERALA,6.3,7.1,1.0,0.4,643.0,65.02811072463768
3184,"RIVER SAL AT ORLIM BRIDGE, ORLIM",GOA,5.2,7.1,2.6,0.34,1411.0,101.5964672463768
3189,RIVER CHAPORA AT SIOLIM,GOA,6.0,7.5,1.6,0.2,4995.0,176.73762492753625
3471,"RIVER KARAMANA AT ARUVIKARA, THIRUVANANTHAPURAM",KERALA,7.0,7.1,0.5,0.32,211.0,47.53841536231885
1564,"AYUR, KERALA",KERALA,7.0,7.152000000000001,1.2,0.22,0.22,50.162052028985535
1330,"TAMBIRAPARANI AT ARUMUGANERI, TAMILNADU",TAMIL NADU,7.2,7.2,2.28,0.14,236.0,64.67378144927537
1569,"THALIPARAMBA, KERALA",KERALA,6.8,7.35,1.15,0.14,215.0,62.77761527536232
1093,"ULHAS AT U/S OF NRC BUND AT MOHANE, MAHARASHTRA",MAHARASHTRA,6.8,7.8,3.4,0.5,601.0,95.04236927536232
2303,R PULLUR AT PULLUR BR.,KERALA,7.2,5.9,0.8,0.55,440.0,33.70874811594203
3381,"MANDA RIVER (DUDHAI RIVER) AT JAMPA, EAST GARO HILLS",MEGHALAYA,8.8,7.3,1.5,1.62,15.0,46.91350347826086
1342,"ACHENKOIL AT THUMPAMON, KERALA",KERALA,6.8,7.06,0.57,0.4,1769.0,83.386081942029
1545,"RIVER MADAI AT DABOS NAN  VALPOI, GOA",GOA,7.3,6.7,1.5,0.1,1940.0,86.77740115942031
1455,"RUSHIKULYA AT GANJAM U/S, ORISSA",ORISSA,6.9,8.1,2.0,2.26,19058.0,501.0988489855073
1698,GHAGGAR AT D/S CHHATBIR,PUNJAB,5.3,7.5,13.5,5.08,20000.0,623.2625402898551
2284,R NEYYAR AT ARUVIPURAM,KERALA,6.9,7.2,0.5,0.18,151.0,48.47799565217391
1438,"MINDHOLA AT STATE HIGHWAY BRIDGE SACHIN, GUJARAT",GUJARAT,6.1,8.0,5.64,1.03,38143.0,959.8372946376812
42,"KALLADA AT PERUMTHOTTAM KADAVU, PUNALOOR",KERALA,7.1,7.2,1.0,0.34,251.0,54.13697507246378
1156,PAMBA AT CHENGANNUR,KERALA,6.0,7.0,1.1,1.04,243.0,56.71700492753624
1564,"R ITHIKKARA AT AYUR, KERALA",KERALA,6.4,7.2,1.9,0.77,258.0,65.68827710144927
1564,"AYUR, KERALA",KERALA,6.3,7.15,1.05,0.22,98.0,54.16398072463768
2326,R KORAYAR AT KANJIKODE,KERALA,6.1,8.0,1.1,0.72,784.0,85.85275130434782
3381,"MANDA RIVER (DUDHAI RIVER) AT JAMPA, EAST GARO HILLS",MEGHALAYA,7.8,7.2,1.6,1.77,20.0,51.00465304347826
1547,"RIVER TALPONA AT CANACONA, GOA",GOA,7.7,6.45,2.14,0.16,10.0,42.92656333333333
2297,R ANCHARAKANDY AT MERUVAMBA,KERALA,6.9,7.1,0.8,0.18,46.0,47.02341565217391
1092,"KALU AT ATALE VILLAGE, MAHARASHTRA",MAHARASHTRA,5.7,7.2,5.3,0.75,116.0,96.06707913043476
1544,"RIVER VALVANT AT SANKLI NAN BICHOLIM, GOA",GOA,7.1,6.6,1.1,0.13,4124.0,131.84103507246377
1573,"IRUMPANAM, KERALA",KERALA,2.4,6.7,2.1,3.97,220.0,77.56368202898553
1705,"U/S SARDULGARH, PUNJAB",PUNJAB,4.7,6.7,26.8,3.7,13250.0,580.0802620289854
1403,"GUMTI AT U/S SOUTH TRIPURA,TRIPURA",TRIPURA,6.6,7.7,1.7,0.0,280.0,71.98315652173913
1155,KARAMANA AT MOONNATTUMUKKU,KERALA,0.8,7.1,11.9,1.87,4250.0,270.28683333333333
1726,"CHANDRAPUR, AGARTALA D/S OF HAORA RIVER, TRIPURA",TRIPURA,7.6,7.763333333333334,1.1,0.6777777777777778,469.77777777777777,67.24232021578102
20,"CHALIYAR AT KOOLIMADU, KERALA",KERALA,6.9,7.067,0.4,0.21,0.21,41.95315265217391
2653,"BHATSA RIVER AT D/S OF LIBERTY OIL MILLS, SATNEL, SHAHAPUR, THANE",MAHARASHTRA,7.0,8.0,3.5,0.49,40.0,85.89366202898552
1341,"PAMBA AT THAKAZHY, KERALA",KERALA,4.8,6.8,0.7,0.8,208.0,54.64714840579711
1476,"MANDOVI AT TONCA, MARCELA",GOA,6.4,6.4,2.0,0.44,15.0,47.19175710144928
2072,RIVER BHOGAVO D/S OF SURENDRANAGAR.,GUJARAT,4.1,7.9,16.5,0.1,58.0,214.50240376811595
1633,"SIMSANG RIVER WILLIAMNAGAR, MEGHALAYA",MEGHALAYA,7.8,7.3,1.9,2.99,264.0,61.02015971014493
3459,"MANIYANKODE PUZHA AT MANIYANKODE BRIDGE, WAYANAD",KERALA,5.8,7.3,0.9,0.88,232.0,60.83286550724638
20,"CHALIYAR AT KOOLIMADU, KERALA",KERALA,7.1,7.1,0.6,0.4,283.0,49.58295507246377
1870,"RIVER SUKHANA AT PARWANOO, DISTT. SOLAN, H.P.",HIMACHAL PRADESH,4.9,7.4,16.3,0.0,51.0,199.1400747826087
21,CHALIYAR AT CHUNGAPALLY,KERALA,7.1,7.1,0.6,0.35,229.0,49.35824840579711
1573,"CHAITRAPUZHA IRUMPANAM, KERALA",KERALA,2.9,6.3,2.0,1.07,430.0,71.84504057971014
1329,"TAMBIRAPARANI AT RAIL BDG. NR. AMBASAMUDAM, TAMILNADU",TAMIL NADU,7.4,6.7,1.6,0.1,91.0,45.72857420289855
3190,RIVER SINQUERIM (CANDOLIM SIDE NEAR BRIDGE),GOA,5.4,7.6,1.6,0.07,290.0,75.55725333333334
1543,"RIVER KALNA AT CHANDELNAN PERNEM, GOA",GOA,7.4,6.73,1.7,0.9,33.0,45.938106869565225
1726,"CHANDRAPUR, AGARTALA D/S OF HAORA RIVER, TRIPURA",TRIPURA,5.4,7.4,3.0,0.06,353.0,85.72032
1340,"MANIMALA  AT KALLOOPARA, KERALA",KERALA,6.6,6.4,0.7,3.13,400.0,43.67352985507247
2300,PERUVAMBA AT CHANDAPPURA,KERALA,6.8,6.0,0.5,0.25,590.0,37.869415942029
1475,ZUARI AT PANCHAWADI,GOA,5.5,6.7,0.8,0.17,1893.0,88.19367971014493
1094,"ULHAS AT U/S OF BADLAPUR, MAHARASHTRA",MAHARASHTRA,6.7,7.4,3.9,0.22,64.0,81.07546289855071
2291,R KEECHERI AT VADAKKANCHERY BRIDGE,KERALA,5.1,6.7,1.9,0.63,405.0,66.50966086956521
1717,"KODRA DAM, MOUNT ABU, RAJASTHAN",RAJASTHAN,4.8,7.3,0.8,1.1,3.0,59.68142840579712
2168,MITHI RIVER,MAHARASHTRA,3.6,7.4,31.3,2.2,276.0,344.3488585507247
3183,"RIVER SAL AT KHAREBAND, MARGAO",GOA,2.8,6.4,3.2,0.35,12658.0,359.179927536232
1456,"RUSHIKULYA AT GANJAM D/S, ORISSA",ORISSA,6.8,7.8,1.65,2.0,440.0,79.75470927536233
3354,"UMIAM MAWPHLANG RIVER AT UMTYNGNGAR, EAST KHASI HILLS",MEGHALAYA,7.6,7.1,1.7,3.0,23.0,51.32010695652174
17,"PERIYAR NEAR ALWAYENANELOOR, KERALA",KERALA,6.0,7.0,2.2,0.68,473.0,73.01738492753624
1861,PURNA ON BRIDGE AT SURATNANNAVSARI HIGHWAY,GUJARAT,5.8,7.7,2.5,0.22,1900.0,120.41700550724636
3183,"SAL AT KHAREBAND, MARGAO",GOA,2.4,6.5,4.8,0.35,7980.0,272.0691153623189
2676,"MUCHKUNDI AT WAKED NEAR M/S ASAHI INDIA GLASS LTD, WAKED, LANJA, RATNAGIRI",MAHARASHTRA,7.4,8.1,2.2,0.15,3.0,73.36374086956522
1632,['FECAL COLIFORM (MPN/100ml)'],MEGHALAYA,8.1,7.03,1.97,2.6537500000000005,230.0,54.70320150724638
1701,GHAGGAR AT D/S JHARMAL NADI,PUNJAB,4.8,7.4,26.0,8.6,31750.0,999.1566684057972
1159,"TAMBIRAPARANI AT PAPAVINASAM,TAMILNADU",TAMIL NADU,7.5,6.5,1.0,0.15,108.0,36.81685391304348
1861,RIVER PURNA ON BRIDGE AT SURATNANNAVSARI HIGHWAY,GUJARAT,7.2,8.07,4.0,0.37,150.0,93.12828811594204
2292,R THIRUR AT THALAKKADATHUR BRIDGE,KERALA,4.9,6.8,1.6,1.0,208.0,64.20138811594202
1400,"MANDOVI AT NEGHBOURHOOD OF PANAJI, GOA",GOA,5.5,7.4,1.5,0.1,2853.0,127.9717463768116
3465,"ACHENKOIL AT KALLARAKADAVU, PATHANAMTHITTA",KERALA,6.6,7.5,1.4,0.7,183.0,63.79564985507246
2271,"RIVER SAL PAZORKHONI,CUNCOLIM(NEAR CULVERT MARGAONAN CANACONA NATIONAL HIGHWAY)",GOA,6.3,6.6,1.6,0.19,2830.0,111.06245072463769
1699,"U/S DHAKANSU NALLAH, PUNJAB",PUNJAB,5.4,6.8,15.4,5.1,9500.0,392.59566
1339,MEENACHIL AT KIDANGOOR,KERALA,6.8,7.1,0.7,0.46,2010.0,90.702435942029
1444,"KALI AT D/S WEST COAST PAPER MILL, KARNATAKA",KARNATAKA,7.3,7.1,2.9,1.17,100.0,64.95778782608696
1152,"KUNDALIKA AT ROHA CITY, MAHARASHTRA",MAHARASHTRA,7.4,7.639,5.9,0.45,0.45,98.0653818695652
1473,"GHAGGAR AT RATANHERI, D/S OF PATIALA NADI (AFTER CONFL.), PUNJAB",PUNJAB,5.1,7.4,23.7,5.9,27333.0,878.5197875362319
3365,"UMSHYRPI RIVER AT UMSHYRPI BRIDGE, EAST KHASI HILLS",MEGHALAYA,4.5,7.1,15.5,11.0,48611.0,1272.6139292753624
1342,ACHENKOIL AT THUMPAMON,KERALA,7.0,7.2,0.8,0.62,279.0,53.50741536231886
1473,"GHAGGAR AT RATANHERI, D/S OF PATIALA NADI (AFTER CONFL.), PUNJAB",PUNJAB,5.0,7.2,26.1,3.05,32250.0,1023.6682744927537
2297,R ANCHARAKANDY AT MERUVAMBA,KERALA,6.7,6.6,1.2,0.34,228.0,46.86914289855073
1444,"KALI AT D/S WEST COAST PAPER MILL, KARNATAKA",KARNATAKA,7.3,7.3,2.0,1.28,333.0,65.78359449275362
1632,"GANOL RIVER TURA, MEGHALAYA",MEGHALAYA,7.5,7.5,2.4,3.0,293.0,71.02101391304349
1703,"GHAGGER AT MOONAK, PUNJAB",PUNJAB,4.2,7.73,21.0,1.4,10500.0,497.84921614492754
1568,"VALAYAM, KERALA",KERALA,6.8,6.5,0.5,0.2,98.0,35.56536927536233
2271,"SAL PAZORKHONI, CUNCOLIM (NEAR CULVERT MARGAONAN CANACONA NATIONAL HIGHWAY)",GOA,6.1,6.9,1.8,0.19,1074.0,79.72858463768117
1442,VAMANAPURAM,KERALA,6.3,7.3,1.2,0.29,725.0,72.22996405797102
3376,LUKHA RIVER AT SUNAPUR (TRIBUTARY OF LUNAR),MEGHALAYA,7.7,6.3,2.1,3.88,180.0,44.161133333333325
1443,"ACHENKOIL AT CHENNITHULA, KERALA",KERALA,5.9,6.4,0.7,3.53,375.0,46.53699188405798
1569,THALIPARAMBA,KERALA,6.7,6.8,1.0,0.53,108.0,47.70963623188406
2288,R PALLICKAL AT NELLIMUKAL,KERALA,6.3,7.2,0.8,0.56,357.0,58.64968405797103
2274,RIVER MAPUSA ON CULVERT ON HIGHWAY MAPUSANANPANAJI,GOA,5.3,6.8,1.8,0.3,6458.0,202.28246695652172
2293,R KADALUNDI AT HAJIRAPPALLY,KERALA,7.3,6.6,0.4,0.25,297.0,38.51398115942029
2338,KADAMBAYAR AT MANCKAKADAVU,KERALA,1.8,6.6,2.0,0.39,399.0,81.5279104347826
2162,ULHAS RIVER ATJAMBHUL WATER WORKS.,MAHARASHTRA,6.6,7.6,4.7,0.7,12.0,90.90144985507246
1892,NETRAVATHI U/S OF DHARMASTALA AT WATER SUPPLY INTAKE POINT,KARNATAKA,6.7,7.27,1.33,0.4266666666666667,6.0,54.67489245410627
1330,"TAMBIRAPARANI AT ARUMUGANERI, TAMILNADU",TAMILNADU,7.3,7.1,3.6,0.88,33.0,69.7044811594203
1436,"BHADAR D/S JETPUR VILL. AFTER CONF. OF W.WATER FROM JETPUR CITY,GUJARAT",GUJARAT,5.7,7.62,2.12,0.86,1050.0,97.11150579710144
1698,"D/S CHHATBIR, PUNJAB",PUNJAB,4.7,6.7,25.3,7.7,23500.0,797.216395362319
1461,"BHATSA AT D/S OF PISE DAM NEAR PISE VILLAGE (ULHAS), MAHARASHTRA",MAHARASHTRA,5.3,7.7,3.25,0.38,165.0,89.43923362318841
3187,RIVER MANDOVI NEAR HOTEL MARRIOT,GOA,6.3,7.6,2.3,0.1,2606.0,129.27251072463767
2712,"VAITARNA NR RD BDG, GANDHARE VILL., WADA, THANE",MAHARASHTRA,7.5,8.2,3.5,0.14,32.25,86.77972557971013
2709,"TANSA RIVER NEAR ROAD BRIDGE, VILLAGE DAKEWALI, WADA, THANE",MAHARASHTRA,6.8,8.2,4.3,0.45,28.0,97.17264260869564
1860,BALEHWAR KHADI AT N.H. NO. 8,GUJARAT,5.1,7.8,2.73,0.6,64125.0,1531.2419208695655
2334,RIVER PERIYAR AT PATHALAM,KERALA,5.7,6.8,1.9,0.5,385.0,65.47448579710145
2051,TLAWNG DOWNSTREAM AIZAWL,MIZORAM,7.5,7.8,1.2,0.1166666666666666,0.0,58.76458946859904
3458,KARAPUZHA DAM AT WAYANAD,KERALA,7.0,7.1,0.8,0.35,45.0,46.45125536231885
