STATION CODE,LOCATIONS,STATE,D.O. (mg/l),PH,B.O.D. (mg/l),NITRATENAN N+ NITRITENANN (mg/l),FECAL COLIFORM (MPN/100ml),WQI
43,MUVATTAPUZHA AT VETTIKKATTUMUKKU,KERALA,6.7,7.1,1.2,0.39,964.0,72.1066495652174
1718,"GAGGAR RIVER WHEN ENTERING IN RAJASTHAN FROM HARYANA NEAR RD NO. 629, RAJASTHAN",RAJASTHAN,4.8,7.9,3.2,0.68,6.0,91.46050840579711
1148,AMBIKA AT BILIMORA,GUJARAT,6.0,7.7,3.6,3.12,900.0,110.31309826086958
1455,"RUSHIKULYA AT GANJAM U/S, ORISSA",ORISSA,7.5,7.8,1.78,0.51,7448.0,232.3988239130435
1572,"CHANDRIGIRI PADIYATHADKA, KERALA",KERALA,7.6,6.7,1.1,0.11,613.0,51.98791362318841
3384,"BUGI RIVER AT DALU, SOUTH GARO HILLS",MEGHALAYA,7.2,7.4,2.2,1.0,25.0,62.715428115942046
2460,DAMANGANGA AT DISCHARGE POINT OF DISTILLERY,DAMAN,4.6,8.0,158.8,6.88,35.0,1477.8888489855074
3466,"ACHENKOIL AT PANDALAM (NEAR AYYAPPA TEMPLE),PATHANAMTHITTA",KERALA,6.2,7.3,0.8,0.55,303.0,59.60583768115941
1643,"NAGAVALLI AT RAYAGADA D/S, ODISHA",ODISHA,7.5,8.0,1.7,0.9,8780.0,267.4256139130435
1151,"PATALGANGA AT SHILPHATA, MAHARASHTRA",MAHARASHTRA,6.9,7.5,3.2,0.55,252.0,79.79866898550725
1643,"NAGAVALLI AT RAYAGADA D/S, ",ORISSA,7.7,8.1,1.6,0.71,1930.0,110.21728666666668
1702,"U/S JHARMAL NADI, PUNJAB",PUNJAB,4.8,6.6,15.0,3.3,6000.0,308.45242173913044
2296,R THALLASSERY AT PATHIPPALAM,KERALA,6.5,5.8,0.4,0.54,123.0,24.58332347826087
1860,BALEHWAR KHADI AT N.H. NO. 7,GUJARAT,5.7,8.0,7.4,0.5,14600.0,454.8349457971015
1150,"DAMANGANGA AT KACHIGAON U\S AT GIDC WIER,GUJARAT",GUJARAT,8.0,7.66,1.0,0.4137499999999999,39.375,53.10027129710145
3188,RIVER TIRACOL AT TIRACOL,GOA,6.3,7.6,1.7,0.08,3622.0,146.294144057971
1865,RIVER DHADAR AT KOTHADA,GUJARAT,1.1,7.8,7.67,0.63,28.0,147.6709191304348
2275,"RIVER CHAPORA NEAR ALORNA FORT ,PERNEM",GOA,6.8,6.2,1.6,0.18,9.0,38.10150260869567
2625,MARKANDA D/S KALA AMB/ BOUNDARY OF HARYANA,HIMACHAL PRADESH,8.3,7.6,1.2,0.51,12.0,51.739118260869546
2335,R PERIYAR AT KALAMASSERY,KERALA,5.7,6.9,3.1,0.4,574.0,81.52783246376812
1543,"RIVER KALNA AT CHANDELNAN PERNEM, GOA",GOA,7.0,6.9,1.1,0.09,1641.0,81.47884869565219
1568,"R MAHE AT VALAYAM, KERALA",KERALA,7.3,7.2,0.9,0.38,6490.0,190.80705449275365
1438,"MINDHOLA AT STATE HIGHWAY BRIDGE SACHIN, GUJARAT",GUJARAT,8.0,7.82,1.8,0.64,32618.28571428572,783.4877427494825
1342,"ACHENKOIL AT THUMPAMON, KERALA",KERALA,6.7,7.5,1.4,1.0,183.0,63.34340289855073
21,CHALIYAR AT CHUNGAPALLY,KERALA,7.0,7.1,0.6,0.34,240.0,50.20124202898551
2625,MARKANDA D/S KALA AMB/ BOUNDARY OF HARYANA,HIMACHAL PRADESH,6.6,7.5,1.6,0.0,14.0,61.70511652173913
3378,"MYNTANG RIVER AT MYNSO, JAYANTIA HILLS",MEGHALAYA,7.4,7.1,1.7,2.44,19.0,52.12935420289854
1148,"AMBIKA AT BILIMORA, GUJARAT",GUJARAT,7.0,8.16,4.16,0.34,9593.0,312.6279020289855
2168,MITHI RIVER,MAHARASHTRA,3.4,7.4,31.5,3.32,1767.0,383.3914057971015
2704,"SAVITRI AT MUTHAVALI VILLAGE, MAHAD, RAIGADH",MAHARASHTRA,6.7,7.8,2.4,1.02,3.0,74.11090956521738
1563,"NEYYAR AMARAVILA, KERALA",KERALA,7.2,6.7,0.9,0.28,335.0,46.28240811594203
2319,R ANCHARAKANDY AT MERUVAMBA,KERALA,6.4,6.4,1.2,0.13,168.0,44.365503768115936
2651,"AMBA RIVER AT D/S OF WAKEN BRIDGENANU/S OF JS PETROCHEMICALS, WAKENPHATA, ROHA",MAHARASHTRA,6.6,7.8,4.9,0.2,16.0,96.1540431884058
1152,"KUNDALIKA AT ROHA CITY, MAHARASHTRA",MAHARASHTRA,6.4,7.6,5.7,0.6,23.0,101.02435043478262
1475,ZUARI AT PANCHAWADI,GOA,6.8,7.1,1.65,0.07,22.0,54.37011594202899
1632,"GANOL RIVER TURA, MEGHALAYA",MEGHALAYA,7.1,7.5,2.2,3.2,239.0,69.98736840579711
1342,"ACHENKOIL AT THUMPAMON, KERALA",KERALA,6.6,6.3,0.6,0.3,1033.0,54.834516521739125
1566,"THIRURANGADY, KERALA",KERALA,6.3,6.95,0.65,0.21,253.0,50.61782739130435
1573,"IRUMPANAM, KERALA",KERALA,3.5,6.57,2.13,0.35,220.0,70.07110484057972
2653,"BHATSA AT D/S OF LIBERTY OIL MILLS, SATNEL, SHAHAPUR, THANE",MAHARASHTRA,6.9,7.3,3.4,0.19,31.0,73.08670898550726
1428,"KHARKHLA NEAR SUTNGA KHLIERIAT,JAINTIA HILLS DT.,MEGHALAYA",MEGHALAYA,6.4,3.05,5.07,4.8,18.0,16.8223704347826
2272,"RIVER KUSHAWATI NEAR BUND AT KEVONA,RIVON,SANGUEM",GOA,6.2,7.1,2.1,0.09,920.0,81.63846434782609
2709,"TANSA RIVER NEAR ROAD BRIDGE, VILLAGE DAKEWALI, WADA, THANE",MAHARASHTRA,6.8,7.8,3.3,0.56,33.0,81.48442927536233
1865,RIVER DHADAR AT KOTHADA,GUJARAT,5.3625,7.88,15.0,0.42,3.0,192.8088576086957
2326,R KORAYAR AT KANJIKODE,KERALA,4.4,7.3,0.4,0.15,285.0,64.46852956521738
1701,GHAGGAR AT D/S JHARMAL NADI,PUNJAB,4.7,7.3,32.8,16.4,14388.0,672.6858353623188
1860,BALEHWAR KHADI AT N.H. NO. 8,GUJARAT,5.1,8.1,3.7,0.45,3900.0,185.55812086956524
17,"PERIYAR NEAR ALWAYENANELOOR, KERALA",KERALA,8.1,6.3,1.1,0.31,100.0,31.56262550724638
43,"MUVATTAPUZHA AT VETTIKKATTUMUKKU, KERALA",KERALA,7.2,6.76,1.69,0.45,127.0,49.34151078260868
1545,"RIVER MADAI AT DABOS NAN  VALPOI, GOA",GOA,7.35,7.1,1.42,0.15,41.0,50.21710034782608
1570,"HOSDURG, KERALA",KERALA,6.33,7.17,0.7,0.33,140.0,57.55976530434783
2304,R MOGRAL AT MOGRAL BR.,KERALA,5.7,7.3,1.5,0.35,46.0,65.29262579710145
1156,"PAMBA AT CHENGANNUR, KERALA",KERALA,7.0,6.6,0.6,0.75,295.0,41.66946869565218
3355,"UMIAM MAWPHLANG RIVER AT MAWPHLANG, EAST KHASI HILLS",MEGHALAYA,8.0,7.2,1.4,2.47,5.0,48.01315246376812
1564,"R ITHIKKARA AT AYUR, KERALA",KERALA,6.6,7.2,0.8,0.77,332.0,56.62738318840581
2302,NEELASWARAM AT NAMBIARKAL DAM,KERALA,6.3,7.0,1.4,0.22,963.0,74.5443507246377
3188,RIVER TIRACOL AT TIRACOL,GOA,5.9,7.7,2.1,0.08,1200.0,99.317011884058
2271,"RIVER SAL PAZORKHONI, CUNCOLIM (NEAR CULVERT MARGAONAN CANACONA NATIONAL HIGHWAY)",GOA,6.1,6.5,2.0,0.43,9.0,50.239304637681165
1342,"ACHENKOIL AT THUMPAMON, KERALA",KERALA,7.1,6.942,0.5,0.34,0.34,40.20682507246378
3376,LUKHA RIVER,MEGHALAYA,7.1,6.5,3.8,4.56,674.0,76.72106173913043
1544,"RIVER VALVANT AT SANKLI NAN BICHOLIM, GOA",GOA,7.8,6.4,2.3,0.08,49.0,43.89853971014494
1403,"GUMTI AT U/S SOUTH TRIPURA, TRIPURA",TRIPURA,5.2,7.4,1.4,0.05,203.0,69.13874057971015
1444,"KALI AT D/S WEST COAST PAPER MILL, KARNATAKA",KARNATAKA,7.0,7.2,9.5,0.9,85.0,126.21000869565218
1642,"NAGAVALLI AT JAYKAYPUR D/S, ORISSA",ORISSA,6.9,8.2,2.8,2.12,1400.0,114.36350231884056
2287,R ITHIKKARA AT ITHIKKARA,KERALA,6.3,7.0,0.7,0.85,230.0,51.726490724637685
1151,"PATALGANGA AT SHILPHATA, MAHARASHTRA",MAHARASHTRA,5.9,7.4,6.4,0.4,37.0,106.38671855072464
1024,"GHAGGAR AT 100M D/S CONF. WITH R. SARASWATI (PATIALA),PUNJAB",PUNJAB,4.9,7.4,14.0,4.4,8000.0,371.5147414492754
2293,R KADALUNDI AT HAJIRAPPALLY,KERALA,6.9,6.8,1.6,0.2,82.0,49.632982318840575
2426,MUNIGUDA (D/S OF M/S VEDANTAALUMINA PROJECT),ODISHA,7.1,7.9,1.4,0.48,1065.0,88.19528173913045
2164,VASHISTI AT U/S OF THREE M PAPER MILLS NEAR M/S MULTIFILMS PLASTIC PVT. LTD. AT KHERDI.,MAHARASHTRA,6.9,7.5,2.2,0.42,2.0,65.3300156521739
2270,"RIVER KHANDEPAR AT CODLI NEAR BRIDGE ,U/S OPA WATERWORKS,SANGUEM",GOA,7.1,6.6,1.0,0.12,2367.0,91.10600173913043
18,"PERIYAR AT KALADY, KERALA",KERALA,7.4,7.0,0.9,0.26,386.0,51.435567536231886
1643,"NAGAVALLI AT RAYAGADA D/S, ORISSA",ORISSA,6.3,7.43,2.17,0.76,2825.0,130.1537367246377
2284,R NEYYAR AT ARUVIPURAM,KERALA,7.6,7.2,0.6,0.65,463.0,53.03149362318841
3371,"KYNSHI RIVER AT RANIKOR, WEST KHASI HILLS",MEGHALAYA,7.8,7.0,2.3,4.3,28.0,54.202486376811606
1246,DAMANGANGA AT KACHIGAON D\S (DAMAN),GUJARAT,5.0,8.3,4.1,1.48,7.0,108.1782811594203
1566,"R KADALUNDI AT THIRURANGADY, KERALA",KERALA,6.6,6.9,1.6,0.29,264.0,56.9635231884058
3186,RIVER MANDOVI AT IFFI JETTY,GOA,6.4,7.6,2.2,0.1,3478.0,147.37916376811597
1023,"GHAGGAR AT MUBARAKPUR REST HOUSE (PATIALA), PUNJAB",PUNJAB,7.4,7.5,2.1,1.23,1663.0,101.25560086956524
1443,ACHENKOIL AT CHENNITHULA,KERALA,6.6,6.9,0.9,0.49,223.0,49.823929855072464
3378,"MYNTANG RIVER AT MYNSO, JAYANTIA HILLS",MEGHALAYA,7.8,7.1,1.6,2.62,15.0,49.2480063768116
42,"KALLADA AT PERUMTHOTTAMKADAVU, PUNALOOR, KERALA",KERALA,7.3,7.0,0.7,0.66,228.0,46.53538782608696
2422,"NAGAVALLI AT PENTA U/S, JAYKAYPUR TOWN",ORISSA,7.5,7.9,1.5,1.0,1615.0,99.68434724637682
1567,R KUTTIYADY AT  KUTTIYADY ESTATE,KERALA,7.1,7.0,0.4,0.11,73.0,41.30154840579711
1571,"KAKKADAVU,  KERALA",KERALA,7.5,6.9,0.5,0.2,138.0,40.08098057971015
1024,"GHAGGAR AT 100M D/S CONF. WITH R. SARASWATI (PATIALA),PUNJAB",PUNJAB,5.6,7.4,15.3,15.0,16750.0,566.9132660869565
1545,MADAI AT DABOS NAN  VALPOI,GOA,7.1,6.2,1.4,0.68,6.0,34.839028405797094
3350,UMKHEN AT WAHKDAIT,MEGHALAYA,7.1,7.0,1.8,2.58,20.0,52.76054173913043
2287,R ITHIKKARA AT ITHIKKARA,KERALA,6.1,7.0,0.8,0.66,500.0,59.40371130434782
1865,RIVER DHADAR AT KOTHADA,GUJARAT,6.2,8.4,9.0,0.38,140.0,147.79253101449277
1699,"GHAGGAR AT U/S DHAKANSU NALLAH, PUNJAB",PUNJAB,6.8,7.3,5.4,1.35,635.0,106.84505260869568
3367,"NONBAH RIVER AT NANGSTOIN MARKE, WEST KHASI HILLS",MEGHALAYA,5.1,7.0,3.6,4.7,351.0,86.03612753623189
1643,NAGAVALLI AT RAYAGADA D/S,ORISSA,7.2,8.1,3.1,1.46,2196.0,131.89762144927536
43,"MUVATTAPUZHA AT VETTIKKATTUMUKKU, KERALA",KERALA,7.2,6.8,1.5,0.3,173.0,49.3976147826087
2300,R PERUVAMBA AT CHANDAPPURA,KERALA,6.8,6.9,0.9,0.45,39.0,44.72168260869566
2304,R MOGRAL AT MOGRAL BR.,KERALA,5.2,7.2,1.2,0.18,843.0,82.84175391304348
2701,"SAVITRI JACKWELL AT UPSA KENDRE, NANGALWADI, MAHAD, RAIGAD",MAHARASHTRA,7.1,7.4,2.2,0.63,4.0,62.715501739130445
2291,R KEECHERI AT VADAKKANCHERY BRIDGE,KERALA,5.4,6.6,1.6,0.27,335.0,59.10031999999999
2276,"RIVER BICHOLIM VARAZAN NAGAR , BICHOLIM",GOA,7.0,6.8,2.0,0.49,12140.0,324.4598020289856
1699,"U/S DHAKANSU NALLAH, PUNJAB",PUNJAB,4.9,7.5,16.5,5.0,12375.0,482.3625414492753
2294,R KALLAI AT KALLAI BRIDGE,KERALA,2.8,7.4,1.6,0.47,1050.0,105.65416753623192
1698,"GHAGGAR AT D/S CHHATBIR, PUNJAB",PUNJAB,5.1,7.37,6.93,1.4,2723.0,183.3622875362319
1461,BHATSA AT D/S OF PISE DAM NEAR PISE VILLAGE (ULHAS),MAHARASHTRA,7.0,7.7,3.2,0.13,8.0,77.25512202898551
1162,"TAMBIRAPARANI AT MURAPPANADU, TAMILNADU",TAMIL NADU,6.9,7.1,1.78,0.13,110.0,57.08266898550723
1543,KALNA AT CHANDELNAN PERNEM,GOA,7.3,6.9,0.7,0.09,1430.0,72.17136782608696
21,"CHALIYAR AT CHUNGAPALLY, KERALA",KERALA,6.8,6.98,0.48,0.21,211.0,47.79452460869566
1563,"AMARAVILA, KERALA",KERALA,6.8,6.993,0.9,0.42,0.42,45.72369460869566
2708,"SURYA RIVER AT INTAKE OF VASAINANVIRAR W/S SCHEME, MASVAN, PALGHAR, THANE",MAHARASHTRA,7.1,7.8,3.3,0.44,33.0,80.0150684057971
1862,RIVER KAVERI ON BRIDGE AT BILLIMORANANVALSAD ROAD,GUJARAT,6.7,7.9,2.9,0.63,10725.0,324.1164695652174
2707,"SURYA RIVER AT MIDC PUMPING STATION, GARVASHET, PALGHAR, THANE",MAHARASHTRA,6.8,8.0,3.5,1.0,53.0,87.207035942029
3182,RIVER ZUARI AT MARCAIM JETTY,GOA,5.4,7.2,1.5,0.08,428.0,70.99872666666667
17,"PERIYAR NEAR ALWAYENANELOOR, KERALA",KERALA,6.2,6.46,1.76,0.33,253.0,52.55666634782608
1571,KARINGODE AT KAKKADAVU,KERALA,7.2,7.3,0.9,0.25,330.0,56.24164811594202
2947,"JAWAI AT JAWAI DAM, SIROHI",RAJASTHAN,6.0,8.3,1.4,0.43,5.0,76.59827159420291
2270,"RIVER KHANDEPAR AT CODLI NEAR BRIDGE ,U/S OPA WATERWORKS,SANGUEM",GOA,7.4,6.2,1.3,0.41,11.0,32.59176753623188
1573,IRUMPANAM,KERALA,2.2,6.4,2.3,1.29,1125.0,96.17052260869563
2162,ULHAS RIVER ATJAMBHUL WATER WORKS.,MAHARASHTRA,6.8,7.5,3.8,0.34,88.0,81.90575594202899
1569,"THALIPARAMBA, KERALA",KERALA,7.2,6.935,0.9,0.48,0.48,42.82785278260869
1438,"MINDHOLA AT STATE HIGHWAY BRIDGE SACHIN, GUJARAT",GUJARAT,4.2,7.8,4.0,0.64,23575.0,631.5910968115942
1160,"TAMBIRAPARANI AT CHERANMADEVI,CAUSE WAY,TAMILNADU",TAMIL NADU,6.6,7.27,3.56,0.29,46.0,75.80560918840577
3371,"KYNSHI RIVER AT RANIKOR, WEST KHASI HILLS",MEGHALAYA,8.0,6.9,1.8,3.38,23.0,46.85204579710145
1443,"ACHENKOIL AT CHENNITHULA, KERALA",KERALA,5.4,6.2,0.7,0.5,1250.0,64.65990666666667
1246,"DAMANGANGA AT KACHIGAON D\S (DAMAN),GUJARAT",GUJARAT,4.9,7.4,9.7,0.64,14.0,142.13922811594205
1698,"D/S CHHATBIR, PUNJAB",PUNJAB,5.5,7.4,10.0,6.1,12167.0,415.4177063768117
1151,"PATALGANGA AT SHILPHATA, MAHARASHTRA",MAHARASHTRA,7.0,7.4,3.8,0.26,152.0,80.66383536231885
3357,"UMNGOT RIVER AT SMIT, EAST KHASI HILLS",MEGHALAYA,8.0,7.0,1.4,3.8,17.0,44.95528579710145
21,"CHALIYAR AT CHUNGAPALLY, KERALA",KERALA,6.8,7.0,0.4,1.53,184.0,46.38650260869566
3354,"UMIAM MAWPHLANG RIVER AT UMTYNGNGAR, EAST KHASI HILLS",MEGHALAYA,7.9,7.2,1.7,2.72,20.0,51.5126327536232
1861,RIVER PURNA ON BRIDGE AT SURATNANNAVSARI HIGHWAY,GUJARAT,4.7,8.3,3.7,0.5,9166.0,310.43019536231884
1160,"TAMBIRAPARANI AT CHERANMADEVI,CAUSE WAY,TAMILNADU",TAMIL NADU,7.3,6.763333333333332,1.5,0.14,0.14,44.35048915942027
3379,"MYNTDU RIVER AT LESHKA, JAYANTIA HILLS",MEGHALAYA,7.3,5.6,1.8,2.1,16.0,27.351947826086956
3185,MANDOVI AT AMONA BRIDGE,GOA,6.4,6.7,1.3,0.1,772.0,63.659283768115934
1870,"RIVER SUKHANA AT PARWANOO, DISTT. SOLAN, H.P.",HIMACHAL PRADESH,6.65,7.88,43.0,0.82,9650.0,651.4330563768115
2285,R MAMOM AT MAMOM BRIDGE,KERALA,7.3,7.3,0.9,0.23,1088.0,72.77923449275363
1547,"RIVER TALPONA AT CANACONA, GOA",GOA,6.8,6.9,1.9,0.03,25.0,53.18778260869566
2707,"SURYA RIVER AT MIDC PUMPING STATION, GARVASHET, PALGHAR, THANE",MAHARASHTRA,6.6,8.1,4.6,0.3,16.0,98.73101652173912
3379,"MYNTDU RIVER AT LESHKA, JAYANTIA HILLS",MEGHALAYA,7.5,6.3,1.7,0.82,7.0,37.3139872463768
1704,GHAGGAR AT D/S SARDULGARH,PUNJAB,4.9,7.4,27.8,6.78,19000.0,729.4641147826087
1643,"NAGAVALLI AT RAYAGADA D/S, ORISSA",ORISSA,7.4,8.0,1.7,0.65,3113.0,137.4286275362319
1154,"CHALAKUDY AT PULICKALKANANDAVU, KERALA",KERALA,6.2,6.63,1.27,0.44,128.0,48.20974701449275
1448,"NAGAVALLI AT THOTAPALLI REGULATOR, A.P.",ANDHRA PRADESH,5.6,7.65,1.76,2.0,2636.0,132.7698967536232
2299,R RAMAPURAM AT RAMAPURAM BRIDGE,KERALA,4.0,7.0,0.9,0.03,98.0,65.42373739130434
1338,"PERIYAR AT SEWAGE DISCHARGE POINT, KERALA",KERALA,6.7,6.8,1.0,0.4,230.0,48.69872289855073
2296,R THALLASSERY AT PATHIPPALAM,KERALA,6.5,6.8,0.5,0.24,303.0,46.88306347826088
2687,"PATALGANGA RIVER AT KHALAPUR PUMPING STATION, KHALAPUR, RAIGAD.",MAHARASHTRA,6.0,7.3,8.5,0.4,32.0,122.6463515942029
1473,"GHAGGAR AT RATANHERI, D/S OF PATIALA NADI (A/C), PUNJAB",PUNJAB,6.3,7.7,7.3,3.28,28250.0,769.0216107246378
3189,RIVER CHAPORA AT SIOLIM,GOA,6.3,7.6,1.5,0.06,3803.0,149.27911739130437
1428,"KYRHUKHLA NEAR SUTNGA KHLIERIAT,JAINTIA HILLS DT.",MEGHALAYA,6.58,6.5,5.93,4.0,40.0,83.8741672463768
2286,R AYROOR AT AYROOR BRIDGE,KERALA,6.7,7.3,0.8,0.35,547.0,62.77839623188407
1341,PAMBA AT THAKAZHY,KERALA,4.4,7.1,1.5,1.17,358.0,72.30828956521738
1295,"GHAGGAR NEAR BANKARPUR,DERA BASSI,PUNJAB",PUNJAB,6.7,7.6,7.4,2.88,22250.0,623.3850495652175
2672,"KUNDALIKA RIVER AT DHATAV AT JACKWELL (DRINKING WATER  PUMPING STATIONNANSWEET ZONE), ROHA",MAHARASHTRA,7.3,7.7,3.2,1.0,50.0,76.85146115942031
1700,"D/S DHAKANSU NALLAH, PUNJAB",PUNJAB,4.8,7.4,19.0,4.6,9500.0,449.4129550724638
2293,R KADALUNDI AT HAJIRAPPALLY,KERALA,6.8,7.0,1.7,0.2,249.0,58.28648927536232
2300,R PERUVAMBA AT CHANDAPPURA,KERALA,7.4,6.1,0.9,0.3,690.0,42.50046086956521
2704,"SAVITRI RIVER AT MUTHAVALI VILLAGE, MAHAD, RAIGADH",MAHARASHTRA,6.8,7.7,3.9,4.25,3.0,86.34248927536233
2050,TLAWNG UPSTREAM AIZAWL,MIZORAM,7.4,7.8,0.9,0.12,8.0,56.807720869565216
2332,R BHARATHAPUZHA AT PATTAMBI,KERALA,7.1,8.1,0.9,0.56,524.0,75.05082840579709
1704,"D/S SARDULGARH, PUNJAB",PUNJAB,4.0,7.4,26.0,3.0,31750.0,1002.9853373913044
43,"MUVATTAPUZHA AT VETTIKKATTUMUKKU, KERALA",KERALA,6.8,7.2,0.6,0.39,1200.0,73.41996260869567
1980,AMLAKHADI AT PUNGAM ANKLESHWAR DISTT BHARUCH,GUJARAT,2.0,7.7,32.3,3.44,11498.0,617.2048231884058
3473,"RIVER VALAPATTANAM AT PARASSINIKADAVU, KANNUR",KERALA,6.6,6.8,1.1,0.06,149.0,51.54345652173914
2272,"RIVER KUSHAWATI NEAR BUND AT KEVONA,RIVON,SANGUEM",GOA,7.3,6.2,1.2,0.33,9.0,32.14372782608696
1571,"R KARINGODE AT KAKKADAVU,  KERALA",KERALA,7.0,6.9,1.1,0.18,44.0,45.63684869565219
1699,"U/S DHAKANSU NALLAH, PUNJAB",PUNJAB,5.1,7.2,13.5,2.55,22000.0,682.2732608695653
1400,"MANDOVI AT NEGHBOURHOOD OF PANAJI, GOA",GOA,7.1,8.0,1.25,0.02,3.0,64.5873284057971
1573,"CHITRAPUZHA AT IRUMPANAM, KERALA",KERALA,3.0,6.6,1.7,1.2,247.0,69.82928695652174
2275,"RIVER CHAPORA NEAR ALORNA FORT ,PERNEM",GOA,7.2,6.9,2.2,0.28,134.0,57.55316811594203
1092,KALU AT ATALE VILLAGE,MAHARASHTRA,4.8,7.2,8.4,2.08,177.0,130.3985750724638
1543,"RIVER KALNA AT CHANDELNAN PERNEM, GOA",GOA,7.1,7.1,1.2,0.1,4573.0,151.2726150724638
2423,"BUDHABALANGA, D/S OF BARIPADA TOWN",ODISHA,7.5,7.9,1.8,0.45,1225.0,93.4221139130435
2672,"KUNDALIKA AT DHATAV AT JACKWELL (DRINKING WATER  PUMPING STATIONNANSWEET ZONE), ROHA",MAHARASHTRA,6.9,7.7,3.1,0.42,69.0,78.2631556521739
2290,R PUZHACKAL AT PUZHACKAL BRIDGE,KERALA,5.4,6.5,4.0,0.1,320.0,78.24297333333334
1207,KABBANI AT MUTHANKARA,KERALA,6.8,7.3,0.6,0.4,598.0,61.523955942029
1428,"KHARKHLA NEAR SUTNGA KHLIERIAT,JAINTIA HILLS DT.,MEGHALAYA",MEGHALAYA,4.6,3.0,6.2,2.2,33.0,34.60870898550723
2332,R BHARATHAPUZHA AT PATTAMBI,KERALA,6.6,7.7,1.6,0.2,362.0,73.0116631884058
1548,ASSONORA AT ASSONORA,GOA,7.2,6.1,2.6,0.92,8.0,43.30972144927535
1295,"GHAGGAR NEAR BANKARPUR,DERA BASSI,PUNJAB",PUNJAB,5.0,6.7,7.5,2.2,1300.0,138.49574115942028
1442,"VAMANAPURAM, KERALA",KERALA,6.8,6.976999999999999,0.6,0.53,0.53,42.80481427536231
1719,"GAGGAR RIVER D/S HANUMANGARH NEAR 2 KNJ NAI ABADI, MAKKASR, RAJASTHAN",RAJASTHAN,5.0,7.3,1.7,0.0,4.0,66.59888782608695
2301,R KAVVAI AT KUTTIYOL PALAM,KERALA,6.0,5.9,1.0,0.63,73.0,32.87765826086957
1436,"BHADAR V/S JETPUR VILL. A/C OF W. WATER FROM JETPUR CITY, GUJARAT",GUJARAT,4.3,7.8,103.8,1.23,478.4,993.8919565217392
3352,"UMKHEN RIVER AT DIENGPASOH, EAST KHASI HILLS",MEGHALAYA,7.3,7.3,2.0,3.0,25.0,58.93802782608696
2298,R KUPPAM AT RAYAROM,KERALA,7.8,6.8,1.4,0.3,122.0,44.44467304347826
2274,RIVER MAPUSA ON CULVERT ON HIGHWAY MAPUSANANPANAJI,GOA,4.5,6.6,2.4,0.16,1572.0,98.999855942029
1475,ZUARI AT PANCHAWADI,GOA,6.2,6.9,1.3,0.48,13.0,52.94642434782609
1151,"PATALGANGA AT SHILPHATA, MAHARASHTRA",MAHARASHTRA,6.37,7.06,4.5,0.35,18.0,81.0164431884058
1155,"KARAMANA AT MOONNATTUMUKKU, KERALA",KERALA,6.6,6.77,1.38,1.54,2433.0,101.44700385507248
2712,"VAITARNA NR RD BDG, GANDHARE VILLAGE, WADA, THANE.",MAHARASHTRA,6.6,7.8,3.5,0.57,30.0,84.14981652173913
1151,"PATALGANGA AT SHILPHATA, MAHARASHTRA",MAHARASHTRA,7.4,7.383,6.0,0.61,0.61,94.53988120289854
3305,"BANJAR AT MALANJKHAND NR W/S INTAKE POINT, JABALPUR",MADHYA PRADESH,7.3,7.4,2.1,0.58,4.0,60.89984115942031
3305,"RIVER BANJAR AT MALANJKHAND NEAR W/S INTAKE POINT, JABALPUR",MADHYA PRADESH,7.3,7.3,2.1,0.0,4.0,59.10042782608696
1572,"PADIYATHADKA, KERALA",KERALA,7.1,7.026000000000001,0.4,0.17,0.17,40.25926540579712
20,"CHALIYAR AT KOOLIMADU, KERALA",KERALA,6.9,6.7,0.5,0.2,688.0,51.77766231884058
1340,"MANIMALA  AT KALLOOPARA,",KERALA,7.3,7.1,1.3,0.41,415.0,57.79201449275362
2335,R PERIYAR AT KALAMASSERY,KERALA,4.9,6.7,2.2,0.28,480.0,72.07380811594203
1546,RIVER KHANDEPAR AT OPA NAN PONDA,GOA,7.1,5.9,1.8,0.28,9.0,33.19791507246378
1718,"GAGGAR  ENTERING IN  FROM HARYANA NR RD NO. 629, ",PUNJAB,3.3,7.9,1.3,0.97,5.0,81.91095942028986
1400,MANDOVI AT NEGHBOURHOOD OF PANAJI,GOA,5.8,7.2,5.3,0.17,855.0,112.37565884057972
1455,"RUSHIKULYA AT GANJAM U/S, ORISSA",ORISSA,7.9,7.9,2.1,0.21,993.0,89.09232608695653
1444,"KALI AT D/S WEST COAST PAPER MILL, KARNATAKA",KARNATAKA,7.3,7.3,2.4,3.4,18.0,62.37996115942028
1546,"RIVER KHANDEPAR AT OPA NAN PONDA, GOA",GOA,7.3,7.0,1.5,0.2,1095.0,73.21271449275363
3368,"NONBAH RIVER AT NANGSTOIN MARKE, WEST KHASI HILLS",MEGHALAYA,6.9,7.2,1.4,2.66,14.0,53.52566231884058
1338,"PERIYAR AT SEWAGE DISCHARGE POINT, KERALA",KERALA,6.9,6.784999999999999,1.0,0.15,0.15,42.3459866521739
3187,MANDOVI NEAR HOTEL MARRIOT,GOA,6.1,7.8,1.5,0.06,1032.0,92.16553130434782
2701,"SAVITRI JACKWELL AT UPSA KENDRE, NANGALWADI, MAHAD, RAIGAD",MAHARASHTRA,6.7,7.7,2.3,2.04,5.0,70.9306495652174
1338,"PERIYAR AT SEWAGE DISCHARGE POINT, KERALA",KERALA,6.4,6.6,1.0,0.25,154.0,44.93108376811593
1632,"GANOL RIVER TURA, MEGHALAYA",MEGHALAYA,10.0,7.1,1.0,4.0,240.0,38.569333333333326
1476,"MANDOVI AT TONCA, MARCELA, GOA",GOA,6.5,6.8,2.3,0.04,5.0,62.61407681159421
1427,UMTREW AT BYRNIHAT EAST,MEGHALAYA,7.7,7.2,6.6,3.02,285.0,101.83592666666668
1476,"MANDOVI AT TONCA, MARCELA, GOA",GOA,6.4,7.45,2.02,0.16,1787.0,105.57983976811596
2296,R THALLASSERY AT PATHIPPALAM,KERALA,6.4,6.1,0.7,0.28,213.0,34.86658376811593
1726,"CHANDRAPUR, AGARTALA D/S OF HAORA RIVER",TRIPURA,6.5,8.0,4.2,0.99,488.0,104.57196347826088
1563,"R NEYYAR AT AMARAVILA, KERALA",KERALA,6.7,7.1,0.6,0.0,222.0,50.11150956521739
1444,"KALI AT D/S WEST COAST PAPER MILL, KARNATAKA",KARNATAKA,7.7,7.221999999999999,2.4,0.9,0.9,58.56479999999996
2297,R ANCHARAKANDY AT MERUVAMBA,KERALA,6.7,6.9,0.9,0.2,82.0,46.12089623188407
1564,"AYUR, KERALA",KERALA,7.3,7.4,0.7,4.1,490.0,59.759434492753634
42,"KALLADA AT PERUMTHOTTAMKADAVU, PUNALOOR, KERALA",KERALA,7.2,7.6,1.4,1.0,188.0,62.78358811594202
3025,"TAMBIRAPARANI AT ERAL, THOTHUKUDI, TAMILNADU",TAMILNADU,6.1,7.0,5.2,0.56,26.0,87.67367797101451
1701,"D/S JHARMAL NADI, PUNJAB",PUNJAB,5.0,7.3,19.3,6.2,21467.0,706.2665144927537
2425,"RIVER KERANDI (INTAKE WELL OF NALCO REFINARY, HAL, SUNABEDA)",ODISHA,7.2,7.8,1.3,0.4,328.0,68.47754811594203
1246,"DAMANGANGA AT KACHIGAON D\S (DAMAN),GUJARAT",GUJARAT,4.8,7.5,8.8,0.2,23.0,138.74778840579708
1704,"GHAGGAR AT D/S SARDULGARH, PUNJAB",PUNJAB,3.1,7.6,11.5,4.1,9000.0,383.6358666666666
2291,R KEECHERI AT VADAKKANCHERY BRIDGE,KERALA,6.0,6.9,1.8,0.61,290.0,62.1737115942029
1150,DAMANGANGA AT KACHIGAON U\S AT GIDC WIER,GUJARAT,7.3,7.4,0.7,0.3,6.0,48.50082782608696
1338,"PERIYAR AT SEWAGE DISCHARGE POINT, KERALA",KERALA,6.3,7.0,1.6,0.32,487.0,65.31350405797102
3370,"KYNSHI RIVER AT NANGKHNUM, WEST KHASI HILLS",MEGHALAYA,7.5,7.2,1.6,2.5,22.0,52.576107246376814
18,"PERIYAR AT KALADY, KERALA",KERALA,7.5,6.8,0.8,0.3,200.0,42.38897391304348
1894,KUMARADHARA NAN U/S OF UPPINAGADY TOWN BEFORE CONFLUENCE WITH RIVER NETHRAVATHI,KARNATAKA,6.5,7.1,1.0,0.0,156.0,53.07118347826087
2300,R PERUVAMBA AT CHANDAPPURA,KERALA,6.5,6.5,0.9,0.4,87.0,40.27209681159421
1547,"RIVER TALPONA AT CANACONA, GOA",GOA,7.12,7.55,1.72,0.45,18.0,61.32109034782608
2273,"RIVER SAL NEAR HOTEL LEELA MOBOR,CAVELOSSIM",GOA,5.6,7.7,1.7,0.14,1831.0,111.8115527536232
2676,"MUCHKUNDI RIVER AT  WAKED, NEAR M/S ASAHI INDIA GLASS LTD., LANJA, RATNAGIRI.",MAHARASHTRA,6.9,7.9,2.7,1.58,4.0,76.92142231884058
1865,RIVER DHADAR AT KOTHADA,GUJARAT,7.8,6.933333333333334,19.5,1.1755555555555557,29.88888888888889,204.9745235619968
2287,R ITHIKKARA AT ITHIKKARA,KERALA,6.2,7.2,2.0,1.01,184.0,67.50895101449275
1400,"MANDOVI AT NEGHBOURHOOD OF PANAJI, GOA",GOA,6.0,6.2,1.5,0.28,9.0,41.05283159420291
1865,RIVER DHADAR AT KOTHADA,GUJARAT,8.1,7.6,8.6,0.4,22.0,118.57390550724637
3029,"TAMBIRAPARANI AT SIVALAPERI, CONFLUENCE POINT OF KUTTRALAM FALLS, D/S OF PALAYAMKOTTAI, TIRUNELVELI, TAMILNADU",TAMILNADU,6.5,6.7,3.3,3.0,32.0,64.07284347826088
1162,TAMBIRAPARANI AT MURAPPANADU,TAMIL NADU,6.9,7.0,1.9,0.25,83.0,55.810588985507245
3373,"WAH BLEI AT RIANGDO, WEST KHASI HILLS",MEGHALAYA,7.7,7.1,1.6,3.93,8.0,49.71564
2299,R RAMAPURAM AT RAMAPURAM BRIDGE,KERALA,3.6,6.5,1.8,0.95,105.0,67.52377188405796
1438,"MINDHOLA AT STATE HIGHWAY BRIDGE SACHIN, ",GUJARAT,3.2,7.7,6.3,0.51,3900.0,211.31047304347828
2654,"BHATSA RIVER AT U/S OF LIBERTY OIL MILLS, SATNEL, SHAHAPUR, THANE",MAHARASHTRA,6.9,7.6,3.5,0.75,37.0,79.3816556521739
2305,R SHRIYA AT ANGADIMOGARU,KERALA,6.9,6.7,1.8,0.0,93.0,49.88421565217392
1329,"TAMBIRAPARANI AT RAIL BDG. NR. AMBASAMUDAM, TAMILNADU",TAMIL NADU,7.4,7.0,0.98,0.19,27.0,43.97326420289854
1328,"TAMBIRAPARANI AT PAPPANKULAM,TAMILNADU",TAMIL NADU,7.2,6.4,1.2,0.12,67.0,37.35257478260869
1704,"D/S SARDULGARH, PUNJAB",PUNJAB,5.0,7.4,14.76,2.08,8860.0,388.14104715942034
1462,"PATALGANGA NEAR INTAKE OF MIDC W/W, MAHARASHTRA",MAHARASHTRA,6.47,7.38,3.73,0.31,10.0,79.06524889855072
2288,PALLICKAL AT NELLIMUKAL,KERALA,6.7,7.0,0.5,0.29,208.0,47.17125623188407
1023,GHAGGAR AT MUBARAKPUR REST HOUSE (PATIALA),PUNJAB,5.5,7.4,8.8,5.08,1400.0,161.4656263768116
1573,"IRUPANAM, KERALA",KERALA,6.5,6.57,1.9,0.76,0.76,48.56420681159421
1162,"TAMBIRAPARANI AT MURAPPANADU, TAMILNADU",TAMIL NADU,7.0,7.0,1.5,0.1,113.0,52.45796202898552
2270,"RIVER KHANDEPAR AT CODLI NEAR BRIDGE ,U/S OPA WATERWORKS,SANGUEM",GOA,7.3,7.0,1.0,0.1,1286.0,73.11480115942028
2709,"TANSA RIVER NEAR ROAD BRIDGE, VILLAGE DAKEWALI, WADA, THANE",MAHARASHTRA,6.7,7.8,4.9,0.3,14.0,95.6363895652174
1870,"RIVER SUKHANA AT PARWANOO, DISTT. SOLAN, H.P.",HIMACHAL PRADESH,4.9,7.8,3.5,1.63375,57.0,93.211138115942
1547,RIVER TALPONA AT CANACONA,GOA,7.0,6.9,0.8,0.21,667.0,57.35672869565219
3473,"RIVER VALAPATTANAM AT PARASSINIKADAVU, KANNUR",KERALA,6.6,7.1,1.1,0.26,126.0,56.2861431884058
1633,"SIMSANG RIVER WILLIAMNAGAR, MEGHALAYA",MEGHALAYA,8.3,7.1,2.13,3.56125,270.0,57.37990159420288
2334,RIVER PERIYAR AT PATHALAM,KERALA,5.9,7.0,2.2,0.62,330.0,69.69207188405798
2947,"RIVER JAWAI AT JAWAI DAM, SIROHI, RAJASTHAN",RAJASTHAN,5.3,7.8,1.7,0.3766666666666666,4.333333333333333,73.95413584541062
1475,ZUARI AT PANCHAWADI,GOA,7.0,6.829000000000001,2.4,0.294,712.5,70.65715069565219
1152,"KUNDALIKA AT ROHA CITY, MAHARASHTRA",MAHARASHTRA,6.6,7.75,4.5,0.5,15.0,91.8018791884058
2352,"VAMSHADHARA, KALINGAPATNAM, VIZIANAGARAM",ANDHRA PRADESH,6.4,7.7,1.1,3.34,3.0,61.89300376811593
1702,"U/S JHARMAL NADI, PUNJAB",PUNJAB,6.9,7.4,3.75,0.98,200.0,82.55068231884057
2307,R MANJESWAR AT BAJRAKKARA BR.,KERALA,7.3,6.9,1.9,0.2,89.0,52.39353449275364
1702,"GHAGGAR AT U/S JHARMAL NADI, PUNJAB",PUNJAB,5.2,7.3,6.27,1.4,23723.0,642.3444065797102
1570,"HOSDURG, KERALA",KERALA,6.4,7.1,1.0,5.2,760.0,71.72158376811595
1700,"GHAGGAR AT D/S DHAKANSU NALLAH, PUNJAB",PUNJAB,4.2,7.37,14.67,1.7,34033.0,957.2037501449277
3368,"NONBAH RIVER AT NANGSTOIN MARKE, WEST KHASI HILLS",MEGHALAYA,7.3,7.1,1.6,2.4,19.0,51.72086782608695
2334,RIVER PERIYAR AT PATHALAM,KERALA,6.2,6.8,1.6,0.39,1129.0,76.76352434782608
1428,"KYRHUKHLA NEAR SUTNGA KHLIERIAT,JAINTIA HILLS DT.,MEGHALAYA",MEGHALAYA,5.3,3.3,7.7,3.2,18.0,49.6078936231884
1246,"DAMANGANGA AT KACHIGAON D\S (DAMAN),GUJARAT",GUJARAT,7.5,7.505714285714285,11.7,1.6285714285714286,1484.428571428571,182.59347448447207
2714,"VASHISHTI RIVER AT U/S OF POPHALI NEAR KONPHANSAWANE BRIDGE, CHIPLUN, RATNAGIRI",MAHARASHTRA,7.2,7.2,2.7,1.0,3.0,63.20346811594202
2425,"RIVER KERANDI(INTAKE WELL OF NALCO REFINARY, HAL, SUNABEDA)",ORISSA,6.9,7.6,1.6,1.39,3066.0,130.74214898550724
1155,"KARAMANA AT MOONNATTUMUKKU, KERALA",KERALA,0.8,6.8,7.4,1.0,14825.0,461.20021333333335
